{
 "schemaVersion": 2,
 "contractMigration": {
  "schemaId": "source-input-manifest.v2",
  "previousSchemaId": "source-input-manifest.v1",
  "fromSchemaVersion": 1,
  "toSchemaVersion": 2,
  "breaking": true,
  "policy": {
   "document": "docs/SCHEMA_VERSIONING_POLICY.md",
   "policyVersion": 1,
   "decisionRule": "language-subset",
   "note": "判定は新旧 2 つの schema だけで行う。artifact の中身は見ない"
  },
  "consumerAction": "**schemaVersion で分岐すること。**1 を期待する実装は 2 を受け取ったら停止する。inputDigest の意味と検算手順は v1 から変わっていない。**artifact の配布名は変わらない**。**この manifest は producer の申告であり、受け手の独立検証を置き換えない。**",
  "renamedAssets": [
   {
    "from": "source-input-manifest.v1.schema.json",
    "to": "source-input-manifest.v2.schema.json",
    "reason": "schema ファイル名。artifact 側の名前は変わらない"
   }
  ],
  "history": [
   {
    "shippedIn": "v0.4.0",
    "previousRelease": "v0.3.0",
    "previousSchemaPath": "schemas/source-input-manifest.v1.schema.json",
    "currentSchemaPath": "schemas/source-input-manifest.v1.schema.json",
    "schemaVersionAtTheTime": 1,
    "schemaVersionShouldHaveBeen": 2,
    "versionWasHeld": true,
    "policyVerdict": "BUMP",
    "recordedRetroactivelyIn": "v0.5.0",
    "changes": [
     {
      "kind": "field-added",
      "effect": "WIDEN",
      "schemaPointer": "/properties/inputScope",
      "instancePath": "$.inputScope",
      "added": [
       "inputScope"
      ],
      "reason": "入力の範囲定義を manifest 自身に持たせた（v0.3.0 フォローアップ P1-2）"
     },
     {
      "kind": "constraint-tightened",
      "effect": "NARROW",
      "schemaPointer": "/required",
      "instancePath": "$",
      "added": [
       "inputScope"
      ],
      "reason": "必須にした。**旧 artifact は新 schema で落ちる**"
     }
    ]
   },
   {
    "shippedIn": "v0.5.0",
    "previousRelease": "v0.4.1",
    "previousSchemaPath": "schemas/source-input-manifest.v1.schema.json",
    "currentSchemaPath": "schemas/source-input-manifest.v2.schema.json",
    "schemaVersionAtTheTime": 2,
    "versionWasHeld": false,
    "policyVerdict": "BUMP",
    "changes": [
     {
      "kind": "const-changed",
      "effect": "UNDECIDABLE",
      "schemaPointer": "/properties/schemaVersion/const",
      "instancePath": "$.schemaVersion",
      "from": 1,
      "to": 2,
      "reason": "版を上げた。**下流はここで分岐して止まる**"
     },
     {
      "kind": "field-added",
      "effect": "WIDEN",
      "schemaPointer": "/properties/contractMigration",
      "instancePath": "$.contractMigration",
      "added": [
       "contractMigration"
      ],
      "reason": "**この schema には対応表が無かった。**v0.4.0 で契約を変えたのに記録が残っていなかった原因の一つ"
     },
     {
      "kind": "constraint-tightened",
      "effect": "NARROW",
      "schemaPointer": "/required",
      "instancePath": "$",
      "added": [
       "contractMigration"
      ],
      "reason": "対応表を必須にした。**旧 artifact は新 schema で落ちる**"
     }
    ]
   }
  ]
 },
 "generatedBy": "test/fixtures 固定（手で組んだ・v0.6.18）",
 "generatedAt": "2026-08-15",
 "generatedFromCommit": "0000000000000000000000000000000000000000",
 "purpose": "**CLI 出力の基準の OK 経路が読む、固定の manifest。**live な artifact を読むと再生成のたびに基準が古くなるため、入力を固定する。",
 "inputFilesTotal": 2,
 "inconsistentAcrossArtifacts": 0,
 "mismatchedWithWorkingTreeAtBuild": 0,
 "inputScope": {
  "file": "source-input-scope.v1.json",
  "sha256": "24d10525bc13e37052a7d2329a75c2629879207d83bdf6c44093041dd052d43d",
  "recursiveDirectories": [
   "src/model"
  ],
  "requiredExactFiles": [],
  "allowedGeneratedInputs": [],
  "excludedOutputs": [],
  "notCovered": [],
  "verifyCommand": "node scripts/verifyReleaseSourceInputs.mjs --manifest test/fixtures/ok-source/source-input-manifest.json --source test/fixtures/ok-source"
 },
 "inputFiles": [
  {
   "path": "src/model/a.ts",
   "role": "model",
   "recordedSha256": "dea568425f0105085f68b34cc2e0b8e27eff5ac2c023e79e8b6389ef86d33900",
   "consistentAcrossArtifacts": true,
   "actualSha256AtBuild": "dea568425f0105085f68b34cc2e0b8e27eff5ac2c023e79e8b6389ef86d33900",
   "matchesWorkingTree": true,
   "consumedBy": [
    "artifacts/fixture.json"
   ]
  },
  {
   "path": "src/model/b.ts",
   "role": "model",
   "recordedSha256": "37d08299ed639b70dca0e1d01d42f37049f972da346d054f3abc81c7b3264829",
   "consistentAcrossArtifacts": true,
   "actualSha256AtBuild": "37d08299ed639b70dca0e1d01d42f37049f972da346d054f3abc81c7b3264829",
   "matchesWorkingTree": true,
   "consumedBy": [
    "artifacts/fixture.json"
   ]
  }
 ],
 "verificationRecipe": [
  "この fixture は基準を取るためだけのもの。受け手向けではない"
 ],
 "note": "**この manifest は fixture である。**本番の artifacts/source-input-manifest.json とは別物。"
}
